{
  "task_id": "eco-test-001",
  "version": "0.2.0",
  "created_at": "",
  "fields": [
    {
      "field": "generate_01",
      "name": "检索 dsh-plugin topic 插件清单",
      "module": "mod-query",
      "inputs": {
        "topic": "dsh-plugin",
        "tool": "gh api search/repositories"
      },
      "acceptance_criteria": [
        "repos 数组非空",
        "repos 数组长度 >= 3",
        "每条 repo 含 name 与 url 字段",
        "fetched_at 字段非空"
      ],
      "status": "pending",
      "next": "generate_02"
    },
    {
      "field": "generate_02",
      "name": "检索 discussions 反复需求",
      "module": "mod-query",
      "inputs": {
        "repo": "deepseek-ai/deepseek-harness",
        "keywords": [
          "memory",
          "插件市场",
          "subagent"
        ],
        "tool": "gh api graphql"
      },
      "acceptance_criteria": [
        "topics 数组非空",
        "topics 数组长度 >= 3",
        "每条 topic 含 keyword 与 evidence_url 字段",
        "fetched_at 字段非空"
      ],
      "status": "pending",
      "next": "generate_03"
    },
    {
      "field": "generate_03",
      "name": "检索官方 CONTRIBUTING 立场",
      "module": "mod-query",
      "inputs": {
        "repo": "deepseek-ai/deepseek-harness",
        "paths": [
          "CONTRIBUTING.md",
          "docs/"
        ]
      },
      "acceptance_criteria": [
        "statements 数组非空",
        "每条 statement 含 quote 与 source_url 字段",
        "source_url 字段非空"
      ],
      "status": "pending",
      "next": "generate_04"
    },
    {
      "field": "generate_04",
      "name": "生态位机会分析",
      "module": "mod-generate",
      "inputs": {
        "source": [
          "generate_01",
          "generate_02",
          "generate_03"
        ]
      },
      "acceptance_criteria": [
        "opportunities 数组非空",
        "每条 opportunity 含 gap 与 evidence_ref 字段",
        "risks 数组非空",
        "每条 risk 含 description 与 evidence_ref 字段",
        "conclusion 字段非空"
      ],
      "status": "pending",
      "next": "generate_05"
    },
    {
      "field": "generate_05",
      "name": "物化生态位分析报告",
      "module": "mod-generate",
      "inputs": {
        "source": "generate_04"
      },
      "acceptance_criteria": [
        "artifacts/s005_report.md 文件存在",
        "报告含章节标题'生态位机会'",
        "报告含至少 3 个 https:// 来源链接"
      ],
      "status": "pending",
      "next": "stop"
    }
  ]
}