{
  "task_id": "quant-001",
  "version": "0.2.0",
  "created_at": "2026-07-11",
  "fields": [
    {
      "field": "generate_01",
      "name": "探查 v12 文档与 npz 数据结构（含全量只读基线）",
      "module": "mod-query",
      "inputs": {
        "v12_root": "D:/MyProject/QuantitativeElite_v12",
        "npz_files": [
          "weather_full.npz",
          "nmf_weather.npz",
          "scores_5k_w63.npz",
          "selector_scores_100.npz",
          "terminal_panel.npz"
        ],
        "docs": [
          "ARCHITECTURE.md",
          "methodology.md",
          "AGENTS.md"
        ],
        "checksum_patterns": [
          "**/*.py",
          "**/*.npz",
          "**/*.md"
        ],
        "checksum_scope": "递归枚举 v12_root 下全部文件（含 data/ engine/ backtest/ docs/ 子目录）"
      },
      "acceptance_criteria": [
        "artifacts/s001_intel.json 文件存在且为合法 JSON",
        "npz_schemas 数组长度 >= 5，覆盖 weather_full/nmf_weather/scores_5k_w63/selector_scores_100/terminal_panel 五个文件",
        "npz_schemas 每条含 file/keys/shapes/dtype 字段且均非空",
        "alignment 对象含 weather_start_index、weather_end_index、climate_lag、tail_window_start、tail_window_has_states、panel_length 六个键",
        "alignment.panel_length 为正整数且 weather_end_index <= panel_length",
        "return_source 字段 == \"terminal_panel.daily_return\"",
        "v12_checksums 为对象：键为相对 v12_root 的路径（可含子目录），值为 64 位十六进制 sha256",
        "v12_checksums 键集合 == 递归枚举 v12_root 下全部文件的相对路径集合（至少覆盖全部 .py/.npz/.md）",
        "v12_checksums 在 data/、engine/、backtest/、docs/ 下各有至少 1 个键",
        "v12_checksum_scope 含 pattern/file_count/dirs 字段，且 file_count == v12_checksums 键数",
        "pit_sources 含 weather_full 与 nmf_weather 两键，各含 dates_key/labels/index_meaning 字段（dates_key 可为 null，labels/index_meaning 非空）",
        "doc_pillars 数组长度 >= 3，每条含 title 与 summary 字段"
      ],
      "status": "pending"
    },
    {
      "field": "generate_02",
      "name": "构建市场状态（regime）序列与状态统计",
      "module": "mod-transform",
      "inputs": {
        "source": "generate_01"
      },
      "acceptance_criteria": [
        "artifacts/s002_regime.json 文件存在且为合法 JSON",
        "occupancy 数组长度 == n_weather 且元素为非负整数，总和 == 状态序列长度",
        "transition_matrix 为 (n_weather, n_weather) 数值数组，每行和在 [0.95, 1.05] 内",
        "per_state_ret_stats 长度 == n_weather，每条含 state/mean/vol/count 且 count > 0",
        "nmf_window_stats 对象非空且含 n_days 数值字段",
        "series_file 字段指向 artifacts/regime_series.npz 且该文件存在，内含 day_weather 与 day_climate 数组，长度 == 对齐段长度",
        "lookahead_guard 含 no_future_ref（bool）/max_label_offset（数值）/labeled_length（正整数）/panel_length（正整数）字段",
        "lookahead_guard.no_future_ref == true 且 max_label_offset <= 0（逐日状态标签仅引用当日及以前数据，无未来信息）",
        "lookahead_guard.labeled_length == 状态序列长度（occupancy 总和）",
        "artifacts/regime_series.py 文件存在"
      ],
      "status": "pending"
    },
    {
      "field": "generate_03",
      "name": "5000 信号池近期窗口 IC 筛选",
      "module": "mod-generate",
      "inputs": {
        "source": "generate_01"
      },
      "acceptance_criteria": [
        "method 字段 == \"spearman\"",
        "signal_count == 5000",
        "npz_shape 与 scores_5k_w63.npz 实际形状 (5000, 63, 299) 一致",
        "ic_summary 含 ic_mean 与 ic_std，均为数值且 ic_mean ∈ [-1, 1]",
        "per_signal_ic 数组长度 == 5000，每条含 id/ic_mean/ic_std/icir",
        "stratified 含 quantile_returns（长度 5 的数值数组）与 spread（数值）",
        "top_signals 数组长度 >= 10，每条含 id 与 ic_mean",
        "artifacts/signal_ic_pool.py 文件存在"
      ],
      "status": "pending"
    },
    {
      "field": "generate_04",
      "name": "100 信号树长面板 IC 与逐状态 IC（含样本内段证据）",
      "module": "mod-generate",
      "inputs": {
        "source": [
          "generate_01",
          "generate_02"
        ]
      },
      "acceptance_criteria": [
        "method 字段 == \"spearman\"",
        "n_trees == 100",
        "overall_ic 含 ic_mean 与 icir，均为数值且 ic_mean ∈ [-1, 1]",
        "per_tree_ic 数组长度 == 100，每条含 tree_id/ic_mean/ic_std/icir",
        "is_per_tree_ic 数组长度 == 100，每条含 tree_id/ic_mean/ic_std/icir（仅用样本内 IS 段数据计算）",
        "per_state_ic 数组长度 == s002.n_weather，每条含 state/ic_mean/ic_std/n_days/top_tree_id/top_ic",
        "is_per_state_ic 数组长度 == s002.n_weather，每条含 state/ic_mean/ic_std/n_days/top_tree_id/top_ic",
        "is_per_state_ic 各条 n_days 均为正整数，且 n_days 之和 == round(0.8 * s002.lookahead_guard.labeled_length)（样本内段长度，机械复算）",
        "state_n_days 数组长度 == per_state_ic 长度且元素均为正整数",
        "route_differentiation 为 bool 字段",
        "state_ic_rank_corr 为数值且 ∈ [-1, 1]",
        "artifacts/signal_ic_long.py 文件存在"
      ],
      "status": "pending"
    },
    {
      "field": "generate_05",
      "name": "生成状态路由表（基于样本内段证据）",
      "module": "mod-generate",
      "inputs": {
        "source": [
          "generate_03",
          "generate_04"
        ]
      },
      "acceptance_criteria": [
        "n_states 为整数且 == s004.is_per_state_ic 长度",
        "route 对象键数 == n_states，每个值含 tree_id/ic_mean/n_days/fallback 字段",
        "非 fallback 状态：route[state].tree_id == s004.is_per_state_ic[state].top_tree_id 且 route[state].ic_mean == s004.is_per_state_ic[state].top_ic（绝对差 <= 1e-9）",
        "fallback 状态：route[state].fallback == true 且 route[state].tree_id == global_best.tree_id",
        "global_best.tree_id 为 s004.is_per_tree_ic 中 |ic_mean| 最大者，且 global_best.ic_mean 与之复算一致（绝对差 <= 1e-9）",
        "fallback_rule 字符串非空，且同时含数值 '95' 与 '20'（分别引用 s003 信号池 IC 分布 95% 分位阈值与最小状态样本数）",
        "expected_gain.routed_ic_avg == s004.is_per_state_ic 各条 top_ic 的均值（绝对差 <= 1e-9），expected_gain.global_ic == global_best.ic_mean（绝对差 <= 1e-9）",
        "artifacts/build_route.py 文件存在",
        "artifacts/route_table.json 文件存在"
      ],
      "status": "pending"
    },
    {
      "field": "discriminate_01_verdict",
      "name": "状态自适应策略 IS/OOS 双段回测",
      "module": "mod-verify",
      "inputs": {
        "source": [
          "generate_02",
          "generate_05"
        ]
      },
      "acceptance_criteria": [
        "is_metrics 含 annualized_return/sharpe/max_drawdown/total_return/n_days，均为有限数值",
        "oos_metrics 含 annualized_return/sharpe/max_drawdown/total_return/n_days，均为有限数值",
        "is_metrics.max_drawdown ∈ [-1, 0] 且 oos_metrics.max_drawdown ∈ [-1, 0]",
        "is_metrics.n_days == round(0.8 * s002.lookahead_guard.labeled_length)（样本内段长度，机械复算）",
        "oos_metrics.n_days == s002.lookahead_guard.labeled_length - is_metrics.n_days（样本外段长度，机械复算）",
        "overturn 为 bool，且 overturn == (oos_metrics.sharpe < is_metrics.sharpe - 0.3 || (is_metrics.sharpe > 0 && oos_metrics.sharpe <= 0))（机械复算一致）",
        "overfit_verdict 为字符串：overturn == true 时为 \"overfit\"，否则为 \"ok\"",
        "oos_metrics.sharpe >= 0.0 且 oos_metrics.annualized_return >= 0.0（任务级 OOS 阈值）",
        "baselines 数组长度 >= 2，每条含 name/is_annualized_return/is_sharpe/is_max_drawdown/oos_annualized_return/oos_sharpe/oos_max_drawdown 字段且均为有限数值",
        "equity_curve 数组长度 == is_metrics.n_days + oos_metrics.n_days 且首元素 == 1.0",
        "per_state_perf 数组长度 == s002.n_weather，每条含 state/mean_ret/vol/count 且 count > 0，各条 count 之和 == s002.lookahead_guard.labeled_length",
        "params 含 top_n 数值字段且 == 50（任务级固定 top_n，不允许步骤内另行选择）",
        "artifacts/backtest_adaptive.py 文件存在",
        "artifacts/equity_curve.npz 文件存在且含 equity 与 dates 数组，长度 == is_metrics.n_days + oos_metrics.n_days"
      ],
      "status": "pending",
      "routing": {
        "pass": "generate_06",
        "revise": "generate_05"
      }
    },
    {
      "field": "discriminate_02_verdict",
      "name": "独立审计验证（含点对点/全量只读基线/OOS 复现）",
      "module": "mod-audit",
      "inputs": {
        "source": [
          "generate_01",
          "generate_02",
          "generate_04",
          "generate_05",
          "discriminate_01_verdict"
        ]
      },
      "acceptance_criteria": [
        "checks 数组长度 >= 8，每条含 id/description/passed/evidence 字段",
        "checks 数组含 id ∈ {ic_crosscheck, reproducible_oos, v12_unchanged, point_in_time, thresholds_oos, fields_nonempty, overturn_honest} 的条目",
        "所有 check.passed == true",
        "v12_unchanged 为对象，含 pass（bool）/checked_files（数组）/mismatches（数组）字段",
        "v12_unchanged.checked_files 非空，且 == s001.v12_checksums 的键集合（覆盖 v12 全部 .py/.npz/.md 的路径）",
        "v12_unchanged.mismatches 每条含 path/expected_sha256/actual_sha256 字段；mismatches 非空时 pass 必须为 false",
        "v12_unchanged.pass == true（mismatches 为空，即 v12 全部基线文件未被修改）",
        "ic_crosscheck 含 max_abs_delta 数值且 <= 1e-6（覆盖 s004.is_per_state_ic 与 s005.route 的全部非 fallback 状态）",
        "reproducible 为对象，含 pass（bool）/max_rel_diff（数值）字段，max_rel_diff <= 1e-9 且 pass == true",
        "point_in_time_verdict 为 bool 且 == true",
        "point_in_time_basis 为对象，含 climate_lag/weather_start_index/weather_end_index/panel_length/max_label_offset/no_future_ref/source_files 字段，且 climate_lag >= 0、weather_start_index >= 0、weather_end_index <= panel_length、no_future_ref == true、source_files 非空",
        "summary 含 pass 字段且 == true",
        "artifacts/audit.py 文件存在"
      ],
      "status": "pending",
      "routing": {
        "pass": "generate_06",
        "revise": "generate_05"
      }
    },
    {
      "field": "generate_06",
      "name": "研究报告物化",
      "module": "mod-generate",
      "inputs": {
        "source": [
          "generate_01",
          "generate_02",
          "generate_03",
          "generate_04",
          "generate_05",
          "discriminate_01_verdict",
          "discriminate_02_verdict"
        ]
      },
      "acceptance_criteria": [
        "artifacts/quant_report.md 文件存在",
        "报告含章节标题：方法、数据探查、信号检验、状态路由、回测结果、样本外验证、结论",
        "报告内数字证据（匹配 [-+]?\\d+\\.\\d+ 模式）出现次数 >= 10",
        "报告不含'看起来'、'貌似'、'感觉'、'似乎'、'直觉'、'我认为'、'我觉得'、'显然'等主观非证据性表述（grep 检查 0 命中）",
        "报告含'证据清单'章节，且其中匹配 artifacts/s0[0-9]{2}_[a-z_]+.json#[A-Za-z0-9_.]+ 的引用行数 >= 8",
        "报告含'复现'小节且列出至少 3 个 artifacts/ 下脚本文件名",
        "报告含'限制'小节且非空"
      ],
      "status": "pending"
    }
  ]
}